username,display_name,created_time,digg_count,reply_count,venus_sign,venus_house,nn_sign,nn_house,saturn_sign,saturn_house,dreams,lessons_attracted,life_events,notes,text
marlomacabre,MarloMacabre,2026-07-08T22:15:54,0,0,Virgo,5,Libra,6,Pisces,11,"Live comfortably — eat whatever she wants anywhere, travel freely, sleep in a nice bed; build a quiet dream house with an underground spa; move her body and not be tired; once wanted comedy/entertainment and food/convenience businesses but is losing hope",Learned she can't trust anyone,"Never been in a real relationship at 30; male figures die or leave; bullied and mistreated by women since age 7; built a business in her 20s working 2-3 jobs and lost everything; in and out of the ER; used, abused, and abandoned by friends; neglected and abused by her mother; never fit in anywhere","Venus with Sun in Virgo 5H; NN with Moon, Mercury, Mars in Libra 6H; suppressed the idea of wanting to make existing easier","Okay thanks because I think we’re under represented. I’ve never been a a real relationship as an adult(never engaged, never had a boyfriend or girlfriend, and havent really had s x in 6 years and before that it was kind of difficult too, and I’m 30), I have a sand like grasp on any male figure in my life(they die or go away), and women torture me. I worked really hard in a 20s to start my own business(working 2-3 jobs at a time and providing care for adults(not professionally I did too much for my roommates who I thought were my friends) lost everything and have not been able to grow anything back, I’ve been in and out of the ER, my “friends” turned their backs on me and literally used, abused, and abandoned me so I now have no friends, and I’ve never gotten along with my mother(she neglected and abused me) and adult women have hated me since I was 7(my2nd grade picked on me and female teachers did until I was graduating hs and then just out in the world some women(strangers) automatically dont like me and treat me weird. I’ve been abused at work. I’ve never fit in anywhere. I have Taurus rising, virgo venus in the 5th(with my sun), saturn in pisces in the 11th, and libra north node in the 6th(with my moon mercury and mars). I used to want to be in entertainment but I started tripping and loosing hope when my 20s were ending(I wanted to do comedy and leak into other things like edutainment or events) and before the pandemic I was starting a business and still want to do businesses like in food and convenience(but again Im losing hope). If I could be or have anything rn; I’d like to live comfortably. live to where I can eat whatever I want whenever any restaurant anywhere, travel when and where I want, sleep in a nice bed. I’ve struggled with the idea of want tbh(i’ve spent a lit of time suppressing the idea of want to make existing easier for me.) but I imagine in my fantasies I imagine building a crazy nice house somewhere quite, me being in the underground spa I imagined, and again eating whatever I want(i love food). Also I love fun so I want to move my body and not be tired. I think I learned I cant trust anyone lol"
alarmjed,Alisonn1derland,2026-07-08T22:12:30,0,0,Gemini,3,Leo,5,Leo,5,,,,"Placements only, no narrative",venus in Gemini 3rd house. North node leo & Saturn leo 5th
rociobee_,Rociobee,2026-07-08T22:12:20,0,0,Capricorn,9,Leo,5,Aries,12,,,,"Placements only, no narrative","Cap Venus 9th house , Aries Saturn 12H , Leo NN 5th house"
ggratchan,ggratchan,2026-07-08T22:08:09,0,0,Pisces,11,Capricorn,9,Aquarius,11,,,It's been bad since October last year,,"Taurus rising, Venus in the 11th/pisces, nn in 9th/Cap, Saturn in 11th/aqua. Yeah. It’s been bad since October last year."
edweenuh,Edwina 🇰🇪,2026-07-08T22:08:06,0,0,Sagittarius,8,Virgo,5,Aries,12,"Hates working; passion is helping people and humanitarian work; wants a Chanel flap bag, a Range Rover, and a luxury two-story loft apartment in DC",,,,"Venus in Sagittarius 8th house, Virgo NN in 5th house, Saturn in Aries in 12th house: I hate working, but my passion is helping people and doing humanitarian work, I want a Chanel flap bag, Range Rover, and luxury 2 story loft apartment in dc"
faiththeimaginist,Faith The Imaginist,2026-07-08T21:55:20,1,0,Aquarius,10,Aquarius,11,Capricorn,9,Be a well-respected public speaker and visionary creative director for major brands,"Experiences that made her authentic, resilient, and fearless; learned to quit things quickly; keeps an extremely high self-concept regardless of others' judgments",Lost a lot in the last 4-5 years — the passing of her mother and nephew the biggest; total identity demolition (Uranus through her 1st house),,"I’m a Taurus rising. 10th house Aquarius Venus. 11th house Aquarius North Node. 9th house Saturn in Capricorn. The vision I have for my life is to be a well respected public speaker and visionary creative director for major brands. I feel like I have attracted experiences that have allowed me to be authentic, resilient, and fearless. As a result, I’ve learned to quit things QUICKLY. I’ve lost a lot in the last 4 to 5 years—the passing of my mother and nephew being the biggest. I feel like my identity went through total demolition with Uranus coming through like a huge wrecking ball in my 1st house of self. I have an extremely high self-concept. However, if people were assessing my value based on the amount of people and things I’ve lost this past 5 years—they would have their own analysis. Not that I give a damn as to which conclusion they may have personally drawn."
cozmicdripp,Venus 💋✨🌟,2026-07-08T21:41:55,0,1,Taurus,12,Libra,6,Pisces,11,Be free to travel and experience the world and different cultures; get paid to offer experiences,"Attracts people who need a lot of help — healing emotional wounds or wanting to be carried through life, which she doesn't do anymore",Her mom passed away a month ago; dealing with the loss and grief,,Venus in taurus in the 12h Saturn in the 11h NN in the 6th. My mom just passed away a month ago so I’ve been dealing with the loss and grief from that. My dream is to just be free to travel and experience the world and different cultures and get paid to offer experiences. I feel like I attract people that need help a lot. Whether that’s healing emotional wounds or need someone to carry them through life which I don’t do anymore.
zuzucutie32,Zuzu cutie,2026-07-08T21:39:35,1,0,Leo,4,Libra,6,Pisces,11,Her dreams are prophecies — they always come true,,Lost her dad; lost her job 4 times; losing love and friendships,"Venus conjunct Sun at 25° (5H Placidus / 4H whole sign); NN at 29°; Saturn retrograde; Pluto Scorpio 7H, Jupiter Sagittarius 7H/8H","venus conjunct the sun both at 25 degrees 5th house placidus or 4th house whole sign, nn 29 degrees libra 6th house both house systems and saturn retrograde in pisces 11th house both house systems- ive lost my dad my job 4 times, losing love, losing friendships and my dreams are prophecies they always come true hot addition I have pluto in scorpio 7th house and jupiter in sagittarius 7th house or 8th house whole sign"
thevitaljenn,The Human Design Therapist,2026-07-08T21:38:00,1,0,Pisces,11,Pisces,11,Sagittarius,8,Travel with freedom and flexibility,,,Venus and NN conjunct in Pisces 11H,Venus & NN in 11th Pisces. Saturn in Sag 8th. Dream to travel with freedom and flexibility.
jennifer.white.pigeon,jennifer.white.pigeon,2026-07-08T21:37:04,1,2,Scorpio,7,,,Scorpio,6,,,Working her tail off; no running water at her rental for 2 weeks because she can't afford it,,"I’m a Taurus rising working my tail off and I haven’t had water at my house that I’m renting in 2 weeks because I can’t afford it. Saturn in Scorpio 6th, Venus in 7th house"
itsasimplequestion0,eimaj🫆,2026-07-08T21:35:42,1,0,Leo,5,Scorpio,7,Leo,5,"No dreams or aspirations — saying f it and enjoying whatever time is left; life is good, can't complain",,Stay-at-home mom who hasn't worked in 22 years; separated for 5 years,,"taurus rising. im chillin. venus is in my 5th house in Leo, saturn in 5th house leo and north node in scorpio in 7th house. I dont have any dreams or aspirations. just saying fk it and enjoying whatever time I have left. I haven't worked in 22 years because I was a stay at home mom but we have been seperated for 5 years. life is good. i cant complain."
carrierogers04,Carrie Rogers,2026-07-08T21:31:40,2,0,Scorpio,7,Aquarius,10,Capricorn,9,"Live a fulfilling, relaxing life; be whatever she wants, do whatever she wants, and have the best of everything",Letting go of ideas and people; choosing herself over situations that aren't good for her anymore; willingness to pivot,,,"7h Scorpio Venus
10h Aquarius North Node
9h Capricorn Saturn
Dreams: Live a fulfilling relaxing type of life. Be whatever I want, do whatever I want and have the best of everything.
Lessons: Letting go of ideas, people ect. Choosing myself over situations that aren't good for me anymore. Willingness to pivot."
finding.d0ri,dorii,2026-07-08T21:26:43,1,0,Gemini,2,Taurus,1,Cancer,3,,,,"Placements only, no narrative","2h gemini venus, 1h taurus north node & 3h cancer saturn"
sadgirl.bribri,bri,2026-07-08T21:25:05,0,0,Capricorn,9,Virgo,5,Aries,12,,,Fighting for her life,,"taurus rising that is fighting for my life lol i have a capricorn venus in the 9th house, north node in virgo in the 5th and saturn in aries 12th house"
amyw876,✨🪬 amy 🪬✨,2026-07-08T21:24:13,0,0,Leo,4,Scorpio,7,Leo,4,"Make graphic design (her MFA field, current career) more lucrative; travel more — experience is the best teacher; keep evolving into her north node","Lessons in trust — giving trust and having it broken over and over; learning discernment and objectivity when partnering in business, relationships, friendships",,Moon and Uranus in same sign/house as NN,"Venus in Leo 4th, Saturn in Leo 4th, and NN in Scorpio 7th. As a graphic designer with an MFA in that discipline, I work in this field currently - would love it to be more lucrative than it has been. I’d love to travel more as I’m a student of life and experience is the best teacher. Would love to lean into my NN by continuing to evolve (moon and Uranus live in the same sign and house as NN). 🤷🏼‍♀️Oh and I’ve attracted a lot of lessons in trust - by way of giving my trust and having it broken over and over. And when partnering (in anything business, relationships, friendships), to be as discerning as possible and remain objective as long as possible."
user8784465996935,Lc,2026-07-08T21:18:52,0,0,Cancer,3,Aries,12,Aries,12,,Her life is a lesson for herself and others,Lots of loss — almost everyone gone,Venus with Mars and Sun in Cancer 3H; NN with Saturn and Chiron in Aries 12H,"Venus/Mars/Sun 3rd cancer, north node Saturn Chiron Aries 12th. Lots of loss, I have stories. Almost everyone gone. My life is a lesson for me and others."
alice.estelle,No?,2026-07-08T21:17:22,0,0,Cancer,3,Cancer,3,Taurus,1,Finding where she belongs; falling in love; feeling like her life has fallen into place,"Attracts insane stuff: near-death experiences, medical events, crazy people",Been going through it her whole life,,"I’ve been going through it my whole life but but my Saturn is in 1st, Venus and NN in 3h. I dream about finding where I belong, falling in love, and feeling like my life has fallen into place. And I attract insane stuff in my life: near death experiences, medical events, crazy people, etc."
lrii9l,Be,2026-07-08T21:08:32,0,0,Pisces,11,Pisces,11,Leo,4,"A stable life, financially and physically; many real and genuine friendships and relationships (her walls are always up); most importantly freedom","Lessons about staying alert — expect the unexpected, never fully trust the situation; attracts Pisces placements (especially moons and mars) and cancer mars; attracts insecure people who don't know what they want","Last 2-3 years: lost formative friendships, feeling stuck, trouble continuing education; dad recently passed away",NN retrograde; Saturn retrograde,"Pisces Venus in 11th, Pisces North node also in 11th (retrograde), Leo Saturn in 4th also retrograde. I thought i wasnt the targeted audience until u mentioned losing a loved one, i dont know what time frame you’re asking about exactly but these last 2-3 years been crazy, i lost friendships that shaped me and losing them changed me, been feeling stuck in the same place, having troubles with continuing my education, and just recently my dad passed away. My dream is to live a stable life in the future, financially and physically, to have many real and genuine good connections friendships and relationships bc i seem to lack them, my walls are always up, and most importantly freedom. I feel like all the lessons i attracted was about staying alert if that makes sense, expect the unexpected and never fully trust the situation, if you’re asking about the ppl i attract i genuinely am SICK of how much i attract pisces placements, especially moons and mars, also cancer mars idk what is it with water and fire placements ive been noticing a pattern lol i wish i understood why, personality wise i would say i attract people that don’t know what tf they want or act like they’re sure of themselves when they’re not, just insecure actions in general"
vicgoreiaaa,vicgoreiaaa,2026-07-08T21:02:57,0,0,Virgo,4,Gemini,2,Libra,6,,,Been going through it and not much is going well,,"Venus in Virgo 4th h, Gemini north node, Saturn in 6th h. Have been going through it and not much is going well"
stephyy.cc,Stephy 🌸,2026-07-08T20:57:39,0,0,Aquarius,10,Virgo,5,Aries,12,"More security with immigration, income, and stability","Attracting people who underestimate, belittle, or condescend to her because of her situation",,,"I’m a Taurus rising 🙋🏾‍♀️Aquarius Venus in 10H, north node in Virgo, Saturn in Aries 12H. Dream: more security with immigration, income and stability. I’ve been attracting people who underestimate me, belittle me or condescend to me because of the situation I’ve been in."
bluishtigers,Mayi,2026-07-08T20:50:41,0,1,Aries,12,Aquarius,10,Capricorn,9,"Peace in her heart, hope, lush and beautiful open spaces; physical strength and confidence after an upcoming surgery",Attracts fellow feelers and thinkers; gets messages through books and walks,Relationship struggles complicated by having a kid together; out of work for the summer; financial stress; upcoming surgery; deep-cleaning and reorganizing the apartment,,"Ah my relationship is going through it, but having a kid together makes it extra complicated and hard to figure out the next steps. also out of work for the summer, and finances are stressful right now. in the middle of apartment deep cleaning and reorganization. As for dreams, I am dreaming of peace in my heart, hope, lush and beautiful open spaces. I have a surgery coming up, and I hope it will make exercise easier, because I'm craving physical strength and more confidence. I attract fellow feelers & thinkers. I get messages through books and walks. I have Venus in Aries in my 12th house, Saturn in Cap in 9th, and North Node in Aquarius in 10th."
awaitingragnorok,Uki K,2026-07-08T20:37:41,0,0,Pisces,11,Virgo,5,Aries,12,"Work that gives back to the world, supports sustainable change, and helps people work better together — through research and social engagement",Consistency — in her work and health; making time to enjoy artistic things again while juggling work,,,"Taurus rising, Pisces Venus (11th), Saturn in Aries and north node in Virgo. And uh..I have a lot of interests. 😅 But ultimately I want the work I do to give back to the world in a way that supports sustainable change and helps us all work better together; some of that is through doing a lot of research and social engagement. But a lesson I learned is consistency: with the work I’m doing and for my health too. And finding time to enjoy doing artistic things. Getting back into that while juggling work."
katttmack,Katie Mack,2026-07-08T20:30:45,1,1,Aries,12,Virgo,6,Aries,12,,,Got an office job last August after 5 years bartending; lost essentially all close friends; struggling financially since the new job; everything has gone to shit over the past year,Venus and Saturn both in Aries 12H,"Venus and Saturn in Aries in my 12th house and my north node in Virgo in the 6th house. Got an office job last August after bartending for 5 years, lost essentially all of my close friends, I’ve been struggling financially since getting this new job, and it feels like everything has gone to shit over the past year"
sofa28281,Soph,2026-07-08T20:30:11,0,0,Aquarius,10,Scorpio,7,Pisces,11,"Stability; the big unrealistic version: travel, leisure, and being able to spoil her friends",,A 12-year relationship splitting up; starting therapy to process childhood trauma; realizing how codependent she is; identity crisis,,"Taurus rising going through a 12 year relationship splitting up, starting therapy to process childhood trauma, realizing how codependent I am and having an identity crisis - venus is 10h Aquarius. North node is 7h Scorpio. Saturn is 11h Pisces. Dream is stability. If I’m doing big unrealistic dreams, travel and leisure and being able to spoil my friends."
pinkiepie0326,Brooklynn,2026-07-08T20:20:32,0,0,Aries,12,Aries,12,Cancer,3,To be admired for something she has done,Attracts opportunities to speak her mind and be herself — but can't take them; huge people pleaser,Never been in a relationship at 21; pulls away whenever she gets close; identity issues,,"I’m 12th house Venus and north node and 3rd house Saturn…. I’ve never been in a relationship im 21 and anytime I’m close I just pull away I have a lot of identity issues lol. I think I attract a lot of opportunities to speak my mind or to be myself and I can’t I’m a huge people pleaser. My dream is to be admired for something I’ve done, Im just cliche like that LOL"
dest1ny420,-,2026-07-08T20:05:07,1,0,Gemini,2,Leo,4,Taurus,1,Move abroad and live a nomadic lifestyle working for herself — finally doing it after being let go a couple weeks ago,Attracted a lot of hidden enemies this year (a constant — 12H stellium),Let go from her job a couple of weeks ago,Has a 12H stellium,"Venus 2nd house in Gemini, NN 4th house in Leo, Saturn 1st house Taurus 😅 - my dream for a while has been to move abroad and live a nomadic lifestyle where I work for myself which I’m now finally doing after being let go from my job a couple weeks ago. This year specifically I’ve attracted a lot of hidden enemies but I also have a 12th house stellium so that’s always been a constant"
beepylop,Piklipi,2026-07-08T19:57:48,0,0,,,,,,,,,,"Meta comment, no survey data — asks what Taurus risings are in Vedic astrology",I would love to know what taurus risings are in vedic astrology
drivingmecoconuts,Coconut 🥥,2026-07-08T19:52:55,1,0,Pisces,10,Scorpio,7,Pisces,10,,,,"Placements only, no narrative","Venus in Pisces, 10th house. Saturn in Pisces, 10th house. North Node in Scorpio, 7th house."
ninjbrah,ninjbrah,2026-07-08T19:43:10,1,0,Leo,4,Sagittarius,8,Cancer,3,"Crazy wealth, freedom, time, good people, health, more time to work out, leveling up psychically and spiritually",,"Problems with health, work, job, money, girlfriend",,"Taurus rising. venus 4h leo. sat 3h cancer. nn 8h sag. been going through problems with health, work, job, money, gf. dreams crazy wealth, freedom, time, good people, health, more time to work out, level up psychically and spiritually"
violet_psalm465,violet_psalm465,2026-07-08T19:35:20,1,1,Gemini,2,Pisces,11,Sagittarius,8,Feel secure within relationships of all kinds; have her own business of her own creative creations,"Feels she brings karma to those who wrong her; triggers people's demons with boundaries and consistency, offers patience to change, walks away if they don't","Feels betrayed by close relationships; fallouts with many family members on both her side and her husband's; her mom is a huge, steady part of her life",,Taurus rising. Venus in Gemini 2nd house. Sagittarius Saturn in the 8th house. North node in Pisces in the 11th house. I would like to feel secure within my relationships of all kinds. I feel betrayed by close relationships. My mom is a huge part of my life. She has always been there for me. I’ve had a fallouts with many many family members from my husbands side as well as my side. I would like to have my own business if my own creative creations. I feel like I bring karma to those who have wronged me and everyone around them who won’t stand up for the right thing. I trigger their demons with boundaries and consistency but also with patience for them to change. If they don’t change I walk away and never or hardly ever return.
beloolaaa,beloolaaa,2026-07-08T19:32:44,0,0,,,,,,,,,,"Meta comment, no survey data — curious what the creator is putting together; see her data row 15 seconds earlier",Curious what ur thinking about/putting together
beloolaaa,beloolaaa,2026-07-08T19:32:29,1,0,Leo,5,Cancer,3,Gemini,2,Start a nonprofit; be a writer; create community gardens; build community; share her art; a community farm that functions as a third space,"Lessons on love and connection, plus big lessons about money and fears",Been put through the wringer,,"Hi! Been put through the fucking wringer. I have Leo Venus 5th, NN cancer 3rd house, and Saturn Gemini 2nd house. I want to start a nonprofit, be a writer, create community gardens, build community, share my art, and to have a community farm that functions as a third space. I feel I’ve attracted lessons on love and connection as well as big fat lessons about money, and fears."
roseeaboveit,ROSEE ABOVE INFLUENCE,2026-07-08T19:26:43,1,0,Scorpio,7,Leo,4,Taurus,1,Be a successful woman with a beautiful family; build an empire with her husband,,,,"Venus is in Scorpio in my seventh house north nodeis in Leo my fourth house. Saturn is in my first house Taurus rising, I just want to be a successful woman with a beautiful family, I want to build an empire with my husband"
kellynn.danae,Kellynn ✨,2026-07-08T19:23:01,0,0,Leo,4,Leo,5,Taurus,1,,Been through hell since ~2019 (attributes it to 8H Pluto plus these placements),,"Technically Aries rising at 28°, chart functions like Taurus rising; Venus conjunct NN; Pluto in 8H","Ok I’m technically an Aries rising, but it’s at 28°, so my chart is really set up like a Taurus rising. I have a Taurus Saturn in 1h, Leo Venus in my 4h which is conjunct my Leo nn in my 5h. Pair all that with an 8H Pluto and that explains why is been thru hell since like 2019 fr 😀"
collaqsed,Bon 🦇,2026-07-08T19:20:32,1,0,Sagittarius,8,Taurus,1,Cancer,3,Find a job and move abroad (for safety); wants a partner but losing hope in dating,Learning independence (credits 8H placements); draining one-sided friendships; can't rely on others,"Struggling with all relationships, romantic and platonic; friends vent to her without reciprocity; job market and immigration feel hopeless",Has a T-square,"Taurus Rising here with my North node in 1st/Taurus, Venus in 8th/Sagittarius, and Saturn is in my 3rd/Cancer. Lately I’m really struggling with relationships, not just romantic but platonic as well. It’s hard to maintain a stable relationship with anyone. I’ve tried dating a few people but they’ve been really either really dry or have their own issues to resolve before they’re ready for a relationship. As for friendships, I don’t have many. My friends tend to vent to me a lot, sometimes without even asking for permission so it’s very draining at times because most of the time I just want a lighthearted conversation with someone to distract myself from my own problems. It’s also tough because I don’t feel like I have anyone I can rely on. Whenever I open up, my friends would either brush it aside or make it about them. (Though they’re just relating to my issues with theirs as a way to connect but it always ends up me comforting them.) Frankly I’m slowly giving up on finding a partner even if I want one because the dating scene is just grim right now. I’m trying to be independent, which could also be encouraged with my 8th house placements. Currently I’m working towards on finding a job and moving abroad for safety reasons but given how the job market and immigration situation are, it feels hopeless. I also have a T square if that helps you."
thethirdperspectiv,hiddenfrequency,2026-07-08T19:15:49,5,5,Gemini,2,Libra,6,Aries,12,,Trained self to expect failure before starting; self-worth tied to job/paycheck; familiar felt safe even when hated,"Grew up with no money or safety net; skipped university due to self-doubt; stayed 9 years in a retail job meant to be temporary, climbed to management; currently in Saturn return",Had 3 replies (story continues) — replies unretrievable due to provider ID truncation,"Venus in Gemini 2nd House, North Node in Libra 6th, currently in my Saturn Return in Aries 12th House. This one’s personal.
I grew up with nothing stable. No money, no safety net. So I trained myself to expect things to fail before they even start. It’s easier to brace for the worst than to hope and get let down again. Never went to university because school made me feel stupid, even though deep down I knew I wasn’t. Self doubt won that fight. So I took a retail job that was never supposed to last and stayed 9 years.
I climbed the ladder. Got to management. And then it hit me, my whole sense of worth was tied to that job and that paycheck, which wasn’t even much. I hated it. But it was familiar, and familiar felt safe."
