username,display_name,created_time,digg_count,reply_count,venus_sign,venus_house,nn_sign,nn_house,saturn_sign,saturn_house,dreams,lessons_attracted,life_events,notes,text
belusnchez,Belu🎀,2026-07-10T12:03:22,0,0,Taurus,1,Virgo,5,Capricorn,9,,,Says life is awful and that they are literally an orphan,Houses inferred from signs,"hey taurus rising here. I have a Taurus Venus, north node in Virgo and Saturn in Capricorn.
life is awful man I'm literally an orphan"
oleanderdee,Dee,2026-07-10T11:13:35,0,0,Capricorn,8,Leo,4,Aries,12,"Belonging or feeling fulfilled, being recognized as the best at something, and experiencing different lives in different parts of the world",Attracts unhealed versions of herself and people who need help; lessons through friendship betrayals and stalkers,"Lost an aunt, brother, and dog within two months; isolation and identity crisis","Venus Capricorn 8H as stated, not whole-sign consistent","Taurus raising, lost an aunt, brother and dog in the span of two months, isolation and identity crisis. (Venus in Capricorn 8th house) north node in Leo 4th house, satrun jn Aires 12th house, ig belonging or feeling fulfilled I wanna be recognized at something I wanna be the best at something, I wanna experience different lives in different parts of the world. I attract unhealed versions of myself/people who need help/lessons ig with friendships betrayals/stalkers"
lou719561,lou,2026-07-10T10:44:57,0,0,Scorpio,7,Leo,4,Aries,12,To start dreaming again and live in the body rather than the mind,"Lessons on perception versus reality, insecurities, and fears",,,Taurus Rising. Scorpio Venus 7H. North Node Leo in 4H. Saturn in Aries 12H. My dream is to start dreaming again. My dream is to live in my body not in my mind. I feel like I have attracted lessons on perception vs reality. Lessons of my own insecurities and fears.
loveofmusic73,Loveofmusic73,2026-07-10T10:38:52,0,0,Libra,6,Capricorn,9,Cancer,3,"Peace, not feeling so alone, and making her business successful",Attracts chaos and rapid swings from good to horrible,Has been through it for the past three years,Houses inferred from signs,"Girl you just described my life. I’m a Taurus rising, Venus in Libra, North N in Capricorn, Saturn in Cancer. I have been through it for the past 3 years. My dream is to have some sense of Peace in my life, not to feel so alone and to make my business successful. I’ve attracted chaos for some reason. Chaos in the sense of ups and down 10 minutes good then out of nowhere horrible."
worththewaite,Alex 🍉,2026-07-10T10:32:54,0,0,Virgo,4,Leo,4,Taurus,1,A passionate love,"A lack pattern with someone who comes in and out of her life; learning to let go, stay present, and practice pure love and appreciation","Career, friends, family, finances, and glow-up feel strong; intense spiritual journey over the last two months","Venus Virgo 4H as stated, not whole-sign consistent","Locked in as soon as you said going through it. Taurus rising, 4th house Venus but in Virgo, 4th house nn in Leo, 1st house Taurus Saturn. I have an amazing career, friends, family, finance, even an incredible glow up, but a passionate love is alluding me. Met someone who is like a stone thrown on water coming in and out of my life who feels perfect but what I’m attracting is lack with that right now. I’ve been on a ramped up spiritual journey the last two months as a result where my entire worldviews related to manifestation, the way I’ve seen the world, and how to get my desires, or even what my desires are, has shifted, multiple times, sometimes daily. The lesson I am feeling right now is that I need to let go. Past, future, forget it. Presence is what I’m trying to practice. Pure love and appreciation for the present moment."
kaiteplus888,kaite :),2026-07-10T10:25:43,0,0,Taurus,1,Cancer,3,Taurus,1,"To pursue her passions without worrying about financial upkeep, keep learning across cultures and mediums, have adventure and novelty, and return to slow comfort with someone grounding","Loss, not taking things so seriously, giving less than she receives, enjoying the present, and looking forward to what comes next","Lost her grandmother young, lost all family pets within days during the pandemic, had friendship losses, has never had a romantic relationship by 25, and moved to a different country with a different language","Also mentions Taurus Sun, Virgo Moon, Sagittarius 8H stellium, and Capricorn Moon 9H","taurus rising, venus and saturn in taurus in the first house, as well. north node and sun in cancer in the third house. I also have a stellium in sagittarius (mars, pluto, chiron) in the eighth house, and moon in capricorn in the ninth house. Lost my grandmother who was part of my everyday life at a young age which made me question a lot, and then lost all of my family pets within a few days of eachother during the pandemic. I’ve had various friendship losses (though a few by my own fault). I’ve never been in a romantic relationship and I have just turned 25. I tend to be a very lucky person, I always find out how to make things work but, I have a tendency to think I’m not doing enough or that I’m behind. In the past year, I have moved to a different country with a different language and I have felt a shift of genuine happiness and sense of self that I had not felt in a long time. I don’t think I’ve had a hard life and I’m very grateful for my experiences and privileges that I have. I want to find and pursue what I’m passionate about and not have to worry about the financial upkeep and I want to keep learning about all sorts of things whether that’s through schooling or through other mediums across cultures, language, food, and the world. I want the chance of adventure and new things but also the ability to fall back to my safe space of slow comfort with someone who grounds me and can match my shifting energy. In the past, I believe that I have attracted lessons of loss, learning to not take things so seriously, and stop giving more than I receive, and to enjoy the present for what it is and look forward for what is next to come. :’)"
user9588123234253,gulistan,2026-07-10T10:02:49,0,0,Sagittarius,8,Capricorn,10,Libra,6,"Returning home by becoming fully free from the matrix in body, mind, and soul","Never belonging anywhere or to anyone; attracting toxic, unhealed, unappreciative people who only take while she tries to fix them",Feels she ruined her life trying to fix and help others,"Venus sign inferred from 8H; NN Capricorn 10H as stated, not whole-sign consistent","I am Taurus rising, my Venus is in 8th house, North nod in Capricorn 10th house , Saturn in Libra 6th house ... My dream is returning ""home"" by getting free from this matrix Fully, I mean not only body but specifically mind and soul to tast real freedom... My repetitive pattern is ""feeling of never belonging to no where and no one"" since I can remember in my childhood and attracting toxic, unhealed unappreciative people who only know to take and take more , I ruined my whole life trying to fix and help them ."
bellowing_tulip,bellowing_tulip,2026-07-10T09:21:24,0,0,Scorpio,7,Scorpio,7,Pisces,11,"Freedom, financial stability, being able to roam, and returning to a secure home","Giving love to unhealed people until drained, then rebuilding confidence, trust, and self-love",,,"Taurus rising here 1H, Venus and north node in 7H Scorpio. Saturn 11H in Pisces. I dream of being free, financially stable, able to roam and return to a secure home. I attracted unhealed people that I give love to because I have so much love, until I’m drained and they continue to take. In all relationships. Then I have to start over to build my confidence, trust and self love."
latenightalicee,latenightalicee,2026-07-10T08:23:33,0,1,,,Aries,11,Leo,4,,,Says they have been going through it,"Venus not given; NN Aries 11H as stated, not whole-sign consistent. Sag Sun and Aries Moon also mentioned","Sag sun Aries moon Taurus rising. north node in Aries 11H , Saturn in Leo 4H , been going throooooughhhh it"
ola13hokage,🦋Your_Next_Hokage🦋👸💫,2026-07-10T08:15:28,0,0,Aries,11,Cancer,2,Taurus,1,"To impact and help people, make enough money to serve people's lives, set her table, and have community while working through fear of being seen and shyness","Wounded people, learning it is not her job to save them, becoming less attached, and accepting that people may not stay",Dislikes conventional work,"Venus Aries 11H and NN Cancer 2H as stated, not whole-sign consistent","Venus in Aries 11th house, north node cancer 2nd house, Saturn in Taurus 1st house as a Taurus Rising
My dream hmm! I want to impact people, I want to help people. I want to make so much money that it serves to impact people's life. I would also want to set my table and have a community ( just working towards my fear of being seen and my shyness).
To be honest, I hate the conventional way of work.
I have attracted more wounded people (but finally learnt the hard way that it is not my job to save them). Also I used to easily get attached but I am learning to be detached when someone comes in my life and let it flow. I'm still an emotional person but I have to accept the fact that people might not be here to stay."
pickledjalepeno,pickledjalepeno,2026-07-10T07:47:02,0,0,Libra,6,Libra,6,Aquarius,10,To meet a man who gives more than she does,"Giving too much in romantic and non-romantic relationships, uplifting people until they reach their potential and leave, and feeling drained",An eight-year relationship ended when the partner said his parents did not want him to marry her,"Also mentions Sun, Moon, and Mercury in Sagittarius 8H","heyy Taurus rising here .. Venus and North Node in Libra in 6th, Saturn in Aquarius in 10th house.. I also have a 8th house stellium of Sun, Moon and Mercury in Sagittarius.. Truly my dream is to meet a man who’s a giver.. I feel like I’ve always given myself in a relationship (romantic and non romantic) and people have just taken from me and not cared that they drained me.. truly ive uplifted people raised them to reach their potential and then they’ve left me.. I truly want to meet a man who’s a giver more than I am because I haven’t experienced that.. I had a 8 year relationship where the guy I was with I truly built him from the ground up and gave him my everything and he left me saying his parents don’t want him to get married to me 😔"
angejewellallaa,Ange Jewel Lallaa 🏹,2026-07-10T07:45:06,0,0,Capricorn,9,Capricorn,9,Sagittarius,8,,,,Saturn house inferred from sign; Taurus Moon and Scorpio Sun also mentioned,Taurus rising ♉️and moon. Scorpio sun. Venus and NN in Cap ♑️9H. Saturn in Sag♐️. Say less or say more idc
thandomoshani,B.e.e,2026-07-10T07:24:01,0,0,Sagittarius,8,Sagittarius,8,Aquarius,10,"Adventures that scare and motivate her, plus a countryside experience with nature and calming energy",Feeling stagnant in career and relationships,,,"Venus is in 8H Sag, NN in Sag 8H , Saturn is in my 10H Aquarius. I want adventures that scares me , that motivates me. A countryside experience with nothing but nature and calming energy. I have felt sooo stagnant, career wise and in my relationships as well."
mannixettv,Mannixe ttv,2026-07-10T07:04:07,0,0,Pisces,10,Sagittarius,8,Aquarius,9,"Carrying a musical heritage, which they are working on",Polarizing stability in people and instability in circumstances,"During Saturn return, became suddenly orphaned at 28, got married a few months later, and unexpectedly moved city",Placidus stated and preferred; Venus Pisces 10H and Saturn Aquarius 9H are not whole-sign consistent. Taurus rising 15 degrees,"In placidus (taurus rising 15d), venus in 10h pisces, Saturn in 9H Aquarius, NN in 8H Sagittarius. Different in whole sign but I prefer placidus. My Saturn return entailed becoming suddenly orphaned at 28, getting married a few months later, and moving city unexpectedly. I feel I attract polarising aspects of stability in people and instability in circumstances. With a musical heritage my dream is carry that torch and I’m working on it. I also have become something of a “digital nomad”. It all checks out."
urmrpickles,Avocadoﾒˇ𝘰,2026-07-10T06:29:59,0,0,Aquarius,9,Aries,12,Cancer,3,"Living in solidarity away from blood family with soul family, having comfortable or unlimited financial resources, being happy without being targeted by humbling, becoming optimistic and philosophical, and being a flight attendant to travel","Spiritual attacks, evil eye, reality checks through people, and working to undo familial pessimistic thought patterns",,"Venus Aquarius 9H as stated, not whole-sign consistent","Taurus rising, Venus in the 9th in Aquarius, NN in the 12th in Aries, Saturn in the 3rd Cancer. i honestly wish to live in complete solidarity away from my blood family, with my soul family. Unlimited (or comfortable amount) of financial resources. Always felt spiritual attacks and evil eye, i just want to be happy without being a target of ""humbling"" ya know?✨️✨️🙌🏽 also worked hard to not be such a pessimist due to familial thought patterns.⚠️SOOOOO I wish to be an optimist and philosophical without recieving reality-checks from the universe through ppl😭😭ALSOOO I wish to be a flight attendant, to travel the world😋😋😋"
feyttee,Feyt 👻,2026-07-10T06:25:09,0,0,,,,,,,,,,No placements; says they will return later,I’ll get back to you girl I’m at work
w1nt3r_2n0w,Lud ♁,2026-07-10T06:10:05,0,0,Aquarius,10,Gemini,2,Gemini,2,Living comfortably and getting married to their partner,Survival-mode money lessons and feeling like the universe tells them they do not deserve fun trips,Has not had a stable income since 21 and recently lost a job because of new management,,Taurus rising here. My chart ruler Venus is in the 10th house (Aquarius) and both my Saturn and North Node are in my 2nd house (Gemini). I'm 24 now and haven't had a stable income since I was 21. I actually recently lost my job because of new management. My only dream is to be able to live comfortably and get married to my partner. I'm tired of constantly being in survival mode and not being able to afford things I need. I can't even plan fun trips for myself without the universe telling me I don't deserve them.
saturdayaddamss,Addams,2026-07-10T05:58:21,0,0,Capricorn,9,,,,,,,,Placement-only comment,Cap venus 9th house
saturdayaddamss,Addams,2026-07-10T05:58:14,0,0,Capricorn,9,,,,,,,,Duplicate placement-only comment with typo,Cap venus 9th hoise
cowgirlcrypto,CowgirlCrypto,2026-07-10T05:31:25,0,1,Aries,12,Taurus,1,Aries,12,,,Whole life has changed in the last seven years with major flips,Venus and Saturn signs inferred from 12H; NN house inferred from sign. Taurus Sun and Virgo Moon also mentioned,"taurus rising, taurus sun, Virgo moon.
12th house venus 12th house saturn, north node in taurus.. my whole life has changed in last 7 years..insane flips"
sophieelvari,Elvari,2026-07-10T05:21:18,0,0,Cancer,3,Libra,6,Aries,12,"Freedom to explore, play, and create however she wants; money for hobbies and adventures; an online community where she inspires and helps others",Burnout cycles,,Houses inferred from signs,"Venus cancer, north node libra, Saturn Aries. Dreams are freedom to explore play create in any and every way I desire. Money to pursue all of my hobbies and follow all my adventures. And have an online community where I inspire and help others to do the same. I keep attracting burnout cycles"
lostnight333,lostnight333,2026-07-10T05:14:45,0,0,Sagittarius,8,Taurus,1,Cancer,3,"A home that feels like a peaceful sanctuary, joy, feeling attractive, and feeling safe in both place and body","People pleasing, difficult relationships involving cheating or fighting, family trauma around money, friends coming for money and leaving, being scammed, and losing a lot of money",,Signs inferred from houses; Saturn is retrograde,"Venus 8th house NN in first house Saturn retrograde in 3 house 🏠
my dream I can have my home that feel home peace and be my sanctuary joy and I want to look attractive LIKE I want to feel safe about my place and my body 🥺
👁️I usually attract the lesson about how I became people pleasure and how about massive relationship like cheating or fighting, but it’s not my story at my something like family trauma I especially about money like my friend come to me because money and they gone or I got scam I lost a lot of money💖"
hannahkay66,Hannahkayxx,2026-07-10T05:00:49,0,0,Taurus,1,Leo,4,Taurus,1,Being an artist who can sell from home and owning a home,"Relationships with people who use, neglect, or rely too much on her",,Signs inferred from houses,"Venus and Saturn in the first, north node in the 4th - I would kill to be an artist that could sell from home, also owning a home is a huge goal. I feel like I’m constantly getting into relationships with people that use/neglect me or rely too much on me"
juls_kitty,Juls_kitty,2026-07-10T04:39:48,0,0,Libra,6,Aquarius,10,Capricorn,9,"Freedom from an avatar that does not fit who she is, travel, finding her person, and freeing herself from limiting mindset","Love and beauty, energy vampires, becoming less codependent, and stepping out of her comfort zone",,Venus sign inferred from 6H; also mentions a 6H stellium,"taurus rising here! NN 10th house in aquarius, venus 6th house stellium in 6th house, saturn 9th house capricorn. .. my dream is to be free from this avatar ive been playing that doesnt fit who i am as a person. to be free… to travel more and find my perfect person. free myself from limiting mindset. i attract love.. beauty, but also energy vampires and lessons related to becoming less codependent… and stepping out of my comfort zone"
wanderwherenxt,wanderwherenxt,2026-07-10T04:17:41,0,0,,,,,,,,Associates Taurus risings going through it with Uranus having been in the first house for about eight years,,No requested placements; transit observation only,Uranus just left our first house after being there for 8-ish years. We have been through it 😅🫩
melanatto,YoungMelz,2026-07-10T04:00:23,0,0,Sagittarius,8,Libra,6,Pisces,11,Backpacking Latin America for a year,"Expecting the unexpected and being prepared to be let down, especially in relationships","Works a government 9-5, fears losing financial freedom, and has been helping family at home since her dad was diagnosed with cancer in the last year",,"I’m a Taurus rising I have Venus in Sag in the 8th, NN in Libra in the 6th and Saturn in Pisces in the 11th, I think my biggest dream is to be able to back pack Latin America for a year BUT I currently work a 9-5 with the government, I fear losing financial freedom for something that is temporary, my dad got diagnosed with cancer in the last year so I just been around the house helping my family so I feel stuck with my job and family at home and so I fear I’ll never really have a life of my own. I think biggest lesson with my life is to always expect the unexpected and just be prepared to be let down especially with relationships."
briseeley,Bri,2026-07-10T03:55:41,0,0,Cancer,3,Gemini,2,Libra,6,,,"In the last 18 months got married, received a major medical diagnosis, sold a house, moved back to a place she said she would never live again, closed a business, left her husband, became a nomad, and divorced",Taurus rising 1st house also stated,"Taurus rising, 1st house, Venus cancer 3rd house, N node Gemini 2nd house, Saturn Libra 6th house. In the last 18 months I’ve been married, had a massive medical diagnosis, had to sell our house and move back to the one place I said I never live again, closed my business, left my husband, became a nomad and gotten divorced."
twicestabbedladybeetle,Muhrie.B,2026-07-10T03:40:55,0,1,Aries,12,Sagittarius,8,Aquarius,10,"Owning a ship, learning deep sea diving, and searching for lost vessels",,,Houses inferred from signs,"Venus in Aries. north node in Sag. Saturn in Aquarius. My dream is to own a ship, and learn how to deep sea dive and look for lost vessels."
kellyamchugh,Kelly McHugh,2026-07-10T03:35:27,0,0,Scorpio,7,Libra,6,Pisces,11,A guilt-free life full of beautiful things,People who drain her of the same abundance and beauty she has when she focuses on herself,,Houses inferred from signs,"Taurus Rising, North Node Libra, Venus Scorpio, Saturn Pisces. I crave a guilt free life full of beautiful things and I attract people who drain me of those exact things, I am full of abundance and beauty when I focus on myself"
mylittleheartt3,Mo 🖤,2026-07-10T02:55:17,0,0,Scorpio,7,Aquarius,10,,,,"Loss, betrayal, and feeling affected by dark or hostile energy","Lost love and jobs, has sickness that prevents working, was betrayed by a man she built a home with, and says she was hexed and almost died",Saturn not given; Scorpio Sun/Venus/Pluto 7H stellium also mentioned,"Taurus rising 1st here Scorpio Stellium (Sun/Venus/Pluto) 7th and North node in Aquarius 10th I lost love and jobs and I have some sickness that not able to work , I lost and betrayed by a man I created home from the scratch with and I been hexed like done dark stuffs black magic that almost died so yes I’m going through it"
this.isnt.me777,ariesJupiter777,2026-07-10T02:46:51,0,0,Libra,6,Leo,4,Taurus,1,,,Lost a corporate role and went through a complete mindset and identity shift after things triggered in early 2025 and since October 2025,,"Taurus Rising here, absolutely going thru it since Oct 2025, triggered by things that happened early 2025! Still going the fck thru it. Lost my corporate role, complete mindset and identity shift, lots more. Anyways, SATURN 1H Taurus, NORTH NODE 4H Leo, Venus 6H Libra"
annapatriciaag,Anna Patricia 🤍,2026-07-10T02:45:24,1,0,Sagittarius,8,Gemini,2,Scorpio,7,Traveling and finding someone to do life with,Broken people,"Lost her mom, had unsuccessful relationships, and is stressed by her job",NN house inferred from sign; Capricorn Sun also mentioned,"Venus in Sag 8H stellium, NN in Gemini, Scorpio Saturn 7H stellium. I am also a Capricorn Sun… I’ve lost my Mom, I’ve had unsuccessful relationships, my job is really stressing me out. I just want to travel, find someone to do life with. I feel like I attract broken people."
arriiaz,A,2026-07-10T02:28:28,0,0,Virgo,5,Aquarius,10,Capricorn,9,,,,Placement-only comment,Venus in fifth/virgo. North node in tenth/Aquarius. Saturn in ninth/capricorn.
ebrennan16,Moo 🇨🇦,2026-07-10T02:09:09,0,0,Gemini,1,Aquarius,11,Taurus,1,,,,"Venus Gemini 1H and NN Aquarius 11H as stated, not whole-sign consistent. Saturn sign inferred from 1H; NN is retrograde","Taurus rising- Venus first house Gemini, Saturn first house and North Node retrograde Aquarius 11th house."
nina.from.nowhere,nina from nowhere 📸,2026-07-10T02:02:53,0,0,Taurus,12,Virgo,5,Taurus,12,"Traveling the world, shooting big events and fashion week, being published in magazines, and being free","Money lessons, undercharging herself, unexpected payments, and extreme good and bad money months back to back",Started her own business and freelance photography,"Venus Taurus 12H and Saturn Taurus 12H as stated, not whole-sign consistent; NN house inferred from sign","I’m a Taurus rising! Venus in Taurus in 12h, north node in Virgo, Saturn also in 12h in Taurus 😅 I started my own business/freelance, I am a photographer - my dream is to travel the world and shoot big events, fashion week, be published in magazines and most importantly be free! I feel like I attract a lot of money lessons, undercharging myself, getting unexpected payments come out of nowhere, being on a roller coaster with money - extremely good and bad months back to back"
kaykittles,ETAK,2026-07-10T02:01:44,0,0,Capricorn,8,Taurus,12,Sagittarius,7,"Having a flower farm, doing reiki there, and running grief and healing circles","Being misunderstood, abandonment, intellectualizing everything, addiction, extremes, endings, and death","Left a loved job because of bullying, had an eating disorder flare-up, and had a long-term partner cheat in the last three weeks",All stated placement houses are not whole-sign consistent; rising is close to the cusp. Also mentions an 8H stellium,"Taurus Rising, Venus in Capricorn 8th House, North Node Taurus 12th house (my rising is very close to the cusp), Saturn 7th house Sag. I’ve left my job that I loved because of bullying, eating disorder flare up and my long term partner cheating in the last 3 weeks. My dream is to have a flower farm and do reiki there and run grief and healing circles. I feel like I attract being misunderstood and some abandonment, intellectualising everything, addiction, extremes of everything (good and challenging), lots of endings and death (but that’s probably my 8th house stellium!)"
cinnamongirl09_,V 🧸,2026-07-10T01:02:23,1,1,Aries,12,Aquarius,10,Virgo,5,"Public policy and media or film work, pursuing higher education later in life, travel, and expressing herself fully and physically in appearance",Learning to control what she can when facing obstacles and learning to socialize as an ambivert,,,"Aries Venus 12th house, Aqua NN 10th house, Virgo Saturn 5th house, I’m interested in being in the public policy and media/film field if that makes sense. I also wish to pursue higher education later in life, travel, and express myself fully and physically in appearance. I’ve learned to control what I can when facing obstacles, and I’m still learning to socialize as I’m an ambivert haha"
